start,end,text,speaker
1129.166,1134.469,Самопознание — так потерянная невинность.,SPEAKER_03
1134.529,1144.755,"И здесь неважно, беспокоит вас это или нет, обратного пути не будет.",SPEAKER_03
1144.795,1147.217,Оттого это предприятие не может быть легким.,SPEAKER_03
1148.963,1151.406, но и не может наскучить.,SPEAKER_03
1151.546,1163.479,"Философия морали и политики — это история, итог которой неизвестен, и при том это история о вас.",SPEAKER_03
1166.142,1168.905,Но то личные риски.,SPEAKER_03
1168.965,1170.087,Что до политических.,SPEAKER_03
1171.848,1183.457," Я бы мог с самого начала нашего курса пообещать вам, что лекции, построенные на книгах и обсуждение актуальных проблем, сделают вас более ответственными гражданами.",SPEAKER_03
1183.597,1194.305,"Вы изучите предпосылки государственной политики, отточите суждения, более продуманно включитесь в общественно-политический процесс.",SPEAKER_03
1194.386,1198.208,"Но это было далеко не все, да и не совсем правда.",SPEAKER_03
1198.289,1201.291,По большей части политическая философия работает иначе.,SPEAKER_03
1202.975,1213.358," Допустите, что, напротив, политическая философия подорвет вашу гражданскую позицию, а не укрепит ее.",SPEAKER_03
1213.438,1217.28,"Хотя, возможно, что это только на время.",SPEAKER_03
1217.32,1228.063,"Все потому, что философия — это отчуждающее и отчасти даже разрушающее занятие.",SPEAKER_03
1228.283,1230.144,Вспомните хотя бы Сократа.,SPEAKER_03
1231.529,1241.277," У Платона есть диалог Горгий, в котором друг Сократа, Калликол, пытается уговорить его бросить философствование.",SPEAKER_03
1241.377,1255.368,"Он говорит ему, разумеется, есть своя прелесть и у философии, если заниматься ею умеренно и в молодом возрасте, но стоит задержаться на ней дольше, чем следует, и она погибель для человека.",SPEAKER_03
1255.408,1258.65,"«Послушай моего совета», — говорит Калликол.",SPEAKER_03
1260.025,1262.787, Прекрати свои изобличения.,SPEAKER_03
1262.847,1264.748,Обратись к благозвучию дел.,SPEAKER_03
1264.808,1273.895,"Не с тех, бери пример, кто копается в мелочах, опровергая друг друга, но с тех, кто владеет богатством, славою и многими иными благами.",SPEAKER_03
1273.975,1286.704,"По сути, Каликол советует Сократу бросить философствовать, спуститься на землю, получить хорошее образование.",SPEAKER_03
1286.784,1288.305,"И он не то чтобы неправ,",SPEAKER_03
1290.038,1298.164," Ведь философия отрывает нас от принятого, от устоявшихся положений и популярных убеждений.",SPEAKER_03
1298.204,1301.386,"Итак, вот риски, личные и политические.",SPEAKER_03
1301.426,1308.331,"А если есть еще какая-то опасность, я бы сказал, что это увертливость, имя ей — скептицизм.",SPEAKER_03
1308.371,1311.093,"Эта идея... Ну, смотрите, в чем дело.",SPEAKER_03
1311.173,1319.379,"Мы не решили раз и навсегда, как поступить в гипотетических примерах и не выбрали принципы решения.",SPEAKER_03
1321.198,1337.983," А если Аристотель, Локк, Кант и Миль не решили эти вопросы за столько лет, то кто мы такие, чтобы думать, что мы в этом зале их решим всего лишь за несколько лекций?",SPEAKER_03
1338.023,1345.745,"Так что, возможно, суть только в том, чтобы каждый выработал собственные принципы, а больше и нечего об этом говорить.",SPEAKER_03
1345.826,1346.886,Нет универсального ключа.,SPEAKER_03
1348.232,1351.173," Вот он, наш скептицизм.",SPEAKER_03
1351.253,1354.074,Вот что я хотел бы ему ответить.,SPEAKER_03
1354.154,1359.076,"Верно, все эти вопросы обсуждаются уже очень и очень долго.",SPEAKER_03
1359.136,1364.138,"Но, возможно, они вновь и вновь возникают и не дают нам покоя.",SPEAKER_03
1364.158,1371.521,"Потому что, с одной стороны, на них невозможно ответить, а с другой, невозможно их избежать.",SPEAKER_03
1371.581,1372.802,Они постоянно с нами.,SPEAKER_03
1373.942,1379.248," И значит, отвечать на них приходится нам с вами снова и снова, каждый день.",SPEAKER_03
1381.771,1387.677,"Так вот, скептик, наверное, вскинул бы руки и бросил все эти рассуждения.",SPEAKER_03
1387.757,1389.839,Раз решений нет.,SPEAKER_03
1389.879,1393.644,Эммануил Кант неплохо описал проблему подобного подхода.,SPEAKER_03
1394.69,1404.3," Скептицизм есть привал для человеческого разума, где он может обдумать свое догматическое странствие, но это вовсе не место для постоянного пребывания.",SPEAKER_03
1404.5,1414.329,"Кант считал, что, позволив себе поддаться скептицизму, мы никогда не сможем побороть метание разума.",SPEAKER_03
1414.43,1417.172,"Итак, всем этим я попытался раскрыть для вас...",SPEAKER_03
1418.309,1426.912," некоторые риски и соблазны, подводные камни и открывающиеся возможности.",SPEAKER_03
1427.012,1435.815,"Но я мог просто сказать, что в течение курса хочу пробудить метание вашего разума и посмотреть, куда это нас заведет.",SPEAKER_03
1435.855,1436.815,Большое вам спасибо.,SPEAKER_03
1446.435,1450.416," Если такое случится, то придется делать все, лишь бы выжить.",SPEAKER_04
1450.576,1452.276,"Все, что угодно, только чтобы выжить?",SPEAKER_04
1452.336,1454.937,"Да, иногда приходится решать именно так.",SPEAKER_04
1454.977,1461.778,"Когда 19 дней подряд нет ни крошки, кому-то придется жертвовать собой, придется пойти на крайние меры, чтобы остальные выжили.",SPEAKER_04
1461.798,1463.038,"Понятно, хорошо.",SPEAKER_03
1463.078,1463.818,Как вас зовут?,SPEAKER_03
1463.858,1464.438,Маркус.,SPEAKER_03
1464.498,1465.099,Маркус.,SPEAKER_03
1465.159,1466.199,Что вы ответите Маркусу?,SPEAKER_03
1476.284,1482.345," В прошлый раз мы начали с задач, с моральных дилемм.",SPEAKER_03
1482.405,1492.547,"Мы обсуждали вагонетки и врача, который мог вырезать у спящего пациента органы для пересадки.",SPEAKER_03
1492.587,1498.128,Мы заметили пару интересных вещей о наших доводах.,SPEAKER_03
1498.188,1500.769,"Одна о том, как мы подходили к аргументации.",SPEAKER_03
1501.61,1513.698," Мы начали обсуждать гипотетические случаи и старались проговорить, какими принципами мы руководствовались.",SPEAKER_03
1513.718,1525.566,"А затем, когда условия менялись, оказалось, что мы переосмысливаем эти принципы в новых обстоятельствах.",SPEAKER_03
1525.586,1529.009,К тому же мы столкнулись с желанием увязать,SPEAKER_03
1530.508,1537.973," свое суждение в ситуации с теми общими принципами, которые мы позднее озвучивали.",SPEAKER_03
1537.993,1546.939,"А еще мы отметили кое-что о сути аргументов, которые возникли в ходе разговора.",SPEAKER_03
1546.999,1554.944,"Иногда, как мы увидели, нам хочется объяснить допустимость поступка его последствиями, результатом, итогом всей ситуации.",SPEAKER_03
1558.431,1563.632, Мы назвали это консеквенциальным подходом.,SPEAKER_03
1563.672,1573.094,"Но еще выяснилось, что в некоторых ситуациях нам недостаточно одного только результата.",SPEAKER_03
1573.194,1584.277,"Важен, по мнению многих, не только итог, но и некая сущность поступка может определять, насколько он морально допустим.",SPEAKER_03
1587.084,1601.272," Некоторые сочли, что кое-что категорически не может быть правильным, даже если приведет к положительному итогу, даже если пятерых спасет смерть одного.",SPEAKER_03
1601.332,1609.376,"И мы решили, что есть некие безусловные категорические моральные принципы.",SPEAKER_03
1609.456,1616.34,Сегодня и на следующих встречах мы начнем разбирать самую значительную версию,SPEAKER_03
1617.725,1622.689, Консеквенциальную теорию морали.,SPEAKER_03
1622.769,1625.031,Философию утилитаризма.,SPEAKER_03
1627.453,1643.847,"Иеремия Бентом, британский философ 18 века, дал первое и наиболее ясное систематическое описание утилитаристской этики.",SPEAKER_03
1643.987,1645.068,Его основная идея,SPEAKER_03
1648.078,1659.627," что лежит в основе, очень проста и интуитивно приятна с точки зрения морали.",SPEAKER_03
1659.788,1662.149,Ее суть заключается в следующем.,SPEAKER_03
1662.41,1673.058,"Правильно и справедливо поступать так, чтобы умножать общее счастье.",SPEAKER_03
1673.138,1674.8,Что он под этим подразумевал?,SPEAKER_03
1677.815,1685.14, Перевес с удовольствием по сравнению с болью.,SPEAKER_03
1685.18,1688.223,"Больше счастья, меньше страдань.",SPEAKER_03
1688.283,1694.007,"И вот как он пришел к этой идее, идее увеличивать пользу.",SPEAKER_03
1694.067,1703.934,"Для начала он заметил, что всеми нами, людьми, управляют два великих государя, боль и удовольствие.",SPEAKER_03
1706.066,1709.83, Все мы любим второе и не любим первое.,SPEAKER_03
1714.013,1730.989,"И поэтому в основе морали, неважно, идет речь о нашей личной жизни, или мы в качестве законодателей и граждан обдумываем законы, в основе морали должно неизменно лежать",SPEAKER_03
1733.399,1743.146," стремление увеличить личное или общественное счастье, уровень довольства.",SPEAKER_03
1743.206,1747.21,Принцип наибольшего счастья наибольшего числа индивидуума.,SPEAKER_03
1747.31,1750.732,Часто так это называют.,SPEAKER_03
1750.812,1755.816,"Теперь, когда мы узнали об этом принципе, давайте попробуем применить его...",SPEAKER_03
1758.16,1760.081, На конкретном случае.,SPEAKER_03
1760.141,1765.824,"Для примера возьмем на этот раз реальную историю, а не гипотетическую.",SPEAKER_03
1765.884,1770.106,Судебное дело Королева против Дадли и Стивенса.,SPEAKER_03
1770.166,1775.369,Происходил процесс в 19 веке в Британии.,SPEAKER_05
1775.509,1779.11,Его до сих пор обсуждают со студентами-юристами.,SPEAKER_03
1779.17,1781.752,"Итак, вот что было.",SPEAKER_03
1781.852,1784.253,"Я вкратце перескажу историю, а потом хотелось бы...",SPEAKER_03
1786.06,1795.525," услышать, что бы вы решили, будь вы присяжными.",SPEAKER_03
1795.625,1800.548,"Это статья из газеты того времени, где описано дело.",SPEAKER_03
1800.648,1807.692,"Мы не слышали истории печальнее той, что поведали выжившие с борта яхты «Резидат».",SPEAKER_03
1807.752,1812.275,"Судно затонуло в Южной Атлантике, в 20 тысячах километров от суши.",SPEAKER_03
1813.36,1815.261, Плыли на нем четверо.,SPEAKER_03
1815.361,1827.629,"Капитан Дадли, его первый помощник Стивенс, матрос Брукс, люди выдающихся личных качеств, ну или так говорит автор статьи.",SPEAKER_03
1827.729,1834.393,"Четвертым был Юнга, 17-летний юноша Ричард Паркер.",SPEAKER_03
1834.453,1841.077,"Он остался сиротой, не имел семьи и в тот раз впервые надолго вышел в море.",SPEAKER_03
1843.133,1848.297," Друзья, сообщает газета, пытались отговорить его от путешествия.",SPEAKER_03
1848.337,1854.762,"Паркер же поехал в светлой надежде, что оно сделает из него настоящего мужчину.",SPEAKER_03
1854.822,1856.904,"Увы, этого не случилось.",SPEAKER_03
1856.944,1863.409,"Разыгрался шторм, судно накрыло волной, и резида ушла на дно.",SPEAKER_03
1863.489,1868.032,"Четыре пассажира успели сесть в шлюпку, прихватив с собой лишь...",SPEAKER_03
1870.008,1873.39, две банки консервированных репок.,SPEAKER_03
1873.49,1875.592,Воды не было.,SPEAKER_03
1875.692,1878.314,Первые трое суток они не ели.,SPEAKER_03
1878.374,1883.437,На четвертый день открыли банку репок и съели.,SPEAKER_03
1883.477,1888.481,На следующий день изловили черепаху.,SPEAKER_03
1888.521,1893.964,И вместе со второй банкой овощей она обеспечила их питанием еще ненадолго.,SPEAKER_03
1893.984,1897.327,А потом целых восемь дней они провели без еды и воды.,SPEAKER_03
1898.487,1901.609, Представьте себя в такой ситуации.,SPEAKER_03
1901.649,1904.231,Что бы вы делали?,SPEAKER_03
1904.271,1906.813,Они вот что.,SPEAKER_03
1906.973,1910.355,Юнга лежал на дне спасательной лодки.,SPEAKER_03
1910.375,1912.196,Он занемок.,SPEAKER_03
1912.236,1917.24,"От того, что он опился морской воды против совета товарищей.",SPEAKER_03
1917.32,1918.681,Заболел.,SPEAKER_03
1918.741,1922.183,"И казалось, что скоро умрет.",SPEAKER_03
1922.243,1926.666,На девятнадцатый день капитан Дадли предложил тянуть жеребий.,SPEAKER_03
1928.117,1935.279," Жребий должен был решить, кто из них умрет ради остальных.",SPEAKER_03
1935.379,1938.019,Брукс отказался.,SPEAKER_03
1938.219,1941.0,Ему совсем не понравилась эта идея.,SPEAKER_03
1941.1,1942.64,"Нам неизвестно, по какой причине.",SPEAKER_03
1942.66,1948.401,Не хотел рисковать собой или считал это категорически неправильным подходом.,SPEAKER_03
1948.481,1950.622,Жребия не было.,SPEAKER_03
1953.662,1965.351," На следующий день снова нигде не появилась корабля, и Дадли попросил Брукса отвернуться, а жестом объяснил Стивенсу, что юного Паркера нужно убить.",SPEAKER_03
1965.431,1967.253,Дадли прочел молитву.,SPEAKER_03
1967.293,1973.097,"Он сказал ослабевшему юноше, что пришел его час, и пронзил его еремную вену своим ножом.",SPEAKER_03
1974.762,1981.123, Брукс откинул протесты совести и присоединился к печальной трапезе.,SPEAKER_03
1981.203,1986.624,Четыре дня трое в лодке питались телом и кровью юноши.,SPEAKER_03
1986.644,1988.484,Так все и было.,SPEAKER_03
1988.524,1990.525,А потом их спасли.,SPEAKER_03
1990.625,1998.166,Дадли ужасающе эвфемистично описал этот момент в своем журнале.,SPEAKER_03
1998.226,1999.166,Цитата.,SPEAKER_03
1999.246,2002.867,"«На 24-й день, когда мы были заняты завтраком,",SPEAKER_03
2006.558,2010.299, Наконец появился корабль.,SPEAKER_03
2010.359,2013.18,Немецкое судно подняло на борт троих выживших.,SPEAKER_03
2013.22,2016.101,Их доставили в порт британского Фалмута.,SPEAKER_03
2016.121,2018.321,Арестовали и отправили под суд.,SPEAKER_03
2018.581,2021.402,Брукс выступил свидетелем.,SPEAKER_03
2021.502,2023.782,Дадли и Стивенс предстали перед судом.,SPEAKER_03
2023.863,2025.103,Факты они не оспаривали.,SPEAKER_03
2025.992,2031.117," но настаивали, что действовали по необходимости, оправдывались так.",SPEAKER_03
2031.177,2038.023,"Лучше погибнуть одному, если этим спасутся трое.",SPEAKER_03
2038.203,2042.587,Обвинителя эти доводы ничуть не убедили.,SPEAKER_03
2042.647,2047.972,"Он говорил, что убийство есть убийство, и заседания состоялись.",SPEAKER_03
2048.012,2051.074,"Допустим, вы присяжные.",SPEAKER_03
2051.194,2052.476,"Для простоты обсуждений,",SPEAKER_03
2053.577,2057.381, Оставим в сторону закон.,SPEAKER_03
2057.521,2065.868,"Предположим, что ваша задача — решить, можно ли считать действия Дадли и Стивенса оправданными.",SPEAKER_03
2066.048,2073.514,"Кто согласен, что они невиновны, что они не пошли против нравственности?",SPEAKER_03
2081.138,2086.66," А кто бы сказал, что их поступок противоречит морали?",SPEAKER_03
2086.74,2089.681,Заметное большинство.,SPEAKER_03
2089.721,2095.542,"Что ж, давайте послушаем, почему, и позвольте начать с тех, кто оказался в меньшинстве.",SPEAKER_03
2095.582,2101.764,"Сначала те, кто готов защищать Дадли и Стивенса.",SPEAKER_03
2101.804,2105.385,Почему вы оправдываете их поступок?,SPEAKER_03
2105.445,2107.966,Объясните свое мнение.,SPEAKER_03
2108.026,2108.086,Да?,SPEAKER_03
2110.101,2118.305," Я бы не сказал, что это морально неприемлемо, но для меня есть разница между морально отвратительным и виной перед законом.",SPEAKER_04
2118.365,2123.247,"Иначе говоря, не всегда морально верный поступок нарушает закон.",SPEAKER_04
2123.347,2136.133,"Я не считаю, что необходимость оправдывает убийство или другие преступления, но в какой-то момент степень нужды и правда избавляет вас от вины.",SPEAKER_04
2136.193,2136.493,Хорошо.,SPEAKER_03
2137.353,2138.294, Кто согласен?,SPEAKER_03
2138.394,2140.095,Кто думает так же?,SPEAKER_03
2140.195,2145.479,Есть ли моральное оправдание их поступку?,SPEAKER_03
2145.539,2148.321,Да?,SPEAKER_00
2148.381,2150.142,Спасибо.,SPEAKER_00
2150.222,2154.145,"Если такое случится, то придется сделать все, лишь бы выжить.",SPEAKER_04
2154.923,2156.204," Все что угодно, только чтобы выжить?",SPEAKER_04
2156.244,2157.584,"Да, иногда приходится решать.",SPEAKER_04
2157.644,2158.284,Именно.,SPEAKER_04
2158.324,2166.248,"Когда 19 дней подряд нет ни крошки, кому-то придется жертвовать собой, пойти на крайние меры, чтобы остальные выжили.",SPEAKER_04
2166.268,2174.951,"И если они выживут, допустим, у них все хорошо, то они смогут стать достойными членами общества, которые вернутся домой, откроют миллион благотворительных организаций и всего такого.",SPEAKER_04
2175.131,2177.072,Смогут помочь много кому.,SPEAKER_04
2177.112,2179.253,"В смысле, эти-то я не знаю, чем занимались потом.",SPEAKER_04
2179.313,2182.054,"Может, они, конечно, дальше пошли убивать или еще что.",SPEAKER_04
2182.274,2182.374,Что?,SPEAKER_03
2184.327,2187.208," А что, если они вернулись и стали наемными убийцами?",SPEAKER_03
2187.228,2190.249,"Что, если они решили стать наемными убийцами?",SPEAKER_04
2190.329,2190.849,Ну да.,SPEAKER_04
2190.889,2193.13,"Все бы зависело от того, кого они убили.",SPEAKER_03
2193.21,2195.811,"Ну да, это верно.",SPEAKER_04
2195.871,2196.332,Верно.,SPEAKER_04
2196.372,2197.912,"Было бы интересно, кого они убили.",SPEAKER_04
2197.972,2199.433,"Хорошо, как вас зовут?",SPEAKER_03
2199.493,2200.313,Маркус.,SPEAKER_03
2200.353,2201.013,Маркус.,SPEAKER_03
2201.053,2205.735,"Итак, мы выслушали мнение защитников Дадли.",SPEAKER_03
2205.775,2208.716,"Теперь послушаем тех, кто не согласен.",SPEAKER_03
2208.776,2212.958,Большинство из вас их осуждают.,SPEAKER_03
2213.018,2213.318,Почему?,SPEAKER_03
