start,end,text,speaker
2216.933,2226.818," Я сразу подумала, что, может быть, если им очень уж долго нечего было есть, то, возможно, это повлияло на состояние их рассудка.",SPEAKER_02
2226.878,2230.921,"Может, они были не совсем в своем уме, что их как бы оправдывает.",SPEAKER_02
2231.821,2237.526," И если они плохо заображали, то могли принимать решения, которые в противном случае не приняли бы.",SPEAKER_02
2237.546,2249.215,"И если это уместный аргумент, пошатнувшийся рассудок как бы толкает на подобные решения, и кому-то он кажется убедительным, думает ли кто-то, что это нормальное оправдание?",SPEAKER_02
2249.235,2251.116,"Но мне интересно, как вы считаете?",SPEAKER_03
2251.176,2252.457,Вы их защищаете.,SPEAKER_03
2252.498,2253.979,"Извиняюсь, осуждаете, так?",SPEAKER_03
2254.019,2254.099,Да.,SPEAKER_02
2255.289,2258.251," Да, я думаю, они поступили неприемлемым образом.",SPEAKER_02
2258.271,2258.971,А почему нет?,SPEAKER_03
2259.031,2260.072,Объясните.,SPEAKER_03
2260.132,2262.633,"Маркус, например, их оправдывает.",SPEAKER_03
2262.673,2266.075,"Он сказал... Ну, вы сами всё слышали.",SPEAKER_03
2266.095,2267.856,"Да, слышала.",SPEAKER_02
2267.896,2270.978,"Он говорил, что в таких ситуациях приходится решаться.",SPEAKER_03
2271.058,2271.578,Да.,SPEAKER_02
2271.598,2276.321,Что вы ответите Маркусу?,SPEAKER_03
2276.421,2280.023,"Ну, они... У них не было такой ситуации.",SPEAKER_02
2280.103,2282.825,"Нет обстоятельств, которые бы позволили людям...",SPEAKER_02
2285.003,2290.625," Брать чужую судьбу в свои руки и решать, жить другому человеку или нет.",SPEAKER_02
2290.685,2291.505,Нельзя так делать.,SPEAKER_02
2291.525,2292.806,"Хорошо, ясно.",SPEAKER_03
2292.846,2293.346,Спасибо.,SPEAKER_03
2293.366,2294.046,А как вас зовут?,SPEAKER_02
2294.086,2294.747,Брит.,SPEAKER_03
2294.787,2295.227,Брит?,SPEAKER_03
2295.267,2296.107,Хорошо.,SPEAKER_03
2296.127,2297.308,Кто еще?,SPEAKER_03
2297.348,2298.688,Что вы скажете?,SPEAKER_03
2298.708,2299.629,Встаньте.,SPEAKER_03
2300.089,2306.891,"А Дадли и Стивенс не спрашивали у Ричарда Паркера, согласен ли он, ну, умереть за них.",SPEAKER_02
2307.652,2308.212,И если бы...,SPEAKER_02
2309.628,2314.33," Спросили это, сняло бы это их вину за убийство?",SPEAKER_02
2314.37,2316.851,И можно ли было бы тогда их оправдать?,SPEAKER_02
2316.911,2317.652,Интересно.,SPEAKER_03
2317.672,2319.613,"Итак, у нас появилась идея согласия.",SPEAKER_03
2319.653,2320.293,Как вас зовут?,SPEAKER_03
2321.146,2322.146, Кейтлин.,SPEAKER_02
2322.307,2323.207,Кейтлин.,SPEAKER_03
2323.327,2326.508,"Предположим, спросили, как тогда это выглядело бы.",SPEAKER_03
2326.588,2345.937,"Стоит Дадли над Паркером, с ножиком в руке, и перед молитвой, или вместо, спрашивает, парень, ничего, если я... Мы проголодались, сил нет.",SPEAKER_03
2346.057,2348.438,"То, о чем говорил Маркус.",SPEAKER_01
2348.538,2349.559,"Есть хотим ужасно,",SPEAKER_01
2351.288,2353.209, А ты все равно долго не протянешь.,SPEAKER_03
2353.329,2354.99,"Да, пострадая ради дела.",SPEAKER_02
2355.11,2357.292,Станешь мучеником.,SPEAKER_03
2357.312,2360.674,"Как тебе, а, Паркер?",SPEAKER_03
2360.754,2368.899,"Тогда... Вы думаете, с моральной точки зрения они были бы правы?",SPEAKER_03
2368.939,2371.42,"Паркер, например, тоже не в своем уме.",SPEAKER_03
2371.48,2372.121,Соглашается.,SPEAKER_03
2374.193,2376.534," Не думаю, что были бы правы, просто интересно.",SPEAKER_02
2376.554,2378.614,"То есть даже и тогда, и тогда они не правы?",SPEAKER_03
2378.654,2379.395,Нет.,SPEAKER_02
2379.455,2383.936,"Вы думаете, даже согласие жертвы не оправдала бы их поступка?",SPEAKER_03
2383.976,2392.139,"А есть те, кто подхватит высказанную Китлин мысль о согласии, и те, кто считает, что в этом случае никто не пошел бы против морали.",SPEAKER_03
2392.179,2397.18,"Поднимайте руки, посмотрим.",SPEAKER_03
2397.26,2398.961,Очень любопытно.,SPEAKER_03
2399.001,2401.622,Почему согласие меняет вашу оценку?,SPEAKER_03
2405.616,2406.537, Почему?,SPEAKER_03
2406.577,2406.977,Да?,SPEAKER_03
2406.997,2416.846,"Мне кажется, если бы Паркер сам предложил это, если бы идея была его, вот тогда сложилась бы единственная ситуация, в которой его убийство можно было бы оправдать.",SPEAKER_02
2416.886,2422.652,"Потому что в этом случае нельзя было бы заподозрить, что его заставили, вроде как три на одного или сколько их было.",SPEAKER_02
2423.893,2436.785," И мне кажется, если бы он решил пожертвовать собой ради остальных, если бы это исходило от него самого, многих бы это восхитило, хотя кому-то и не понравилось бы его решение.",SPEAKER_02
2436.885,2446.554,"Итак, если бы Паркер сам предложил, это был бы единственный морально приемлемый вариант его согласия.",SPEAKER_03
2446.594,2447.675,"В других случаях,",SPEAKER_03
2448.925,2452.987, он бы просто сдался под давлением обстоятельств.,SPEAKER_03
2453.007,2456.789,Так ведь?,SPEAKER_03
2456.809,2467.055,"А кто считает, что убийство юноши с его согласия никак не оправдало бы капитана?",SPEAKER_03
2467.255,2468.916,Кто так думает?,SPEAKER_03
2468.976,2470.257,"Да, слушаем ваше мнение.",SPEAKER_03
2470.908,2480.171," Паркера убили в надежде на то, что остальных членов экипажа найдут и спасут, так что никакой реальной причины его убивать не было.",SPEAKER_02
2480.191,2482.551,"Неизвестно, ведь спасут их или нет.",SPEAKER_02
2482.591,2485.412,"А если нет, то он бы умер просто так.",SPEAKER_02
2485.452,2489.053,"И что же убивать их по одному, пока кто-нибудь их не подберет?",SPEAKER_02
2489.073,2491.494,Кто-то же и сам по себе умрет.,SPEAKER_02
2491.734,2494.675,Но с моральной точки зрения логика примерно такая.,SPEAKER_03
2495.845,2507.307," Они могли бы выбирать самого слабого, например, одного за другим до тех пор, пока их не спасут, и хорошо, если до этого доживут целых трое.",SPEAKER_03
2509.255,2514.1," Так вот, если бы Паркер согласился пожертвовать собой, то всё нормально?",SPEAKER_03
2514.14,2514.921,Или всё-таки нет?,SPEAKER_03
2514.981,2517.203,"Нет, я думаю, что нет.",SPEAKER_02
2517.263,2519.325,"Можете пояснить, почему так?",SPEAKER_03
2519.385,2523.409,"Ну, в первую очередь, я считаю, что каннибализм оправдать нельзя.",SPEAKER_02
2523.829,2525.291,Ни при каких обстоятельствах.,SPEAKER_02
2527.642,2535.905," То есть вы категорически против каннибализма, даже при условии, что они дождались, пока он умрет.",SPEAKER_03
2535.925,2537.345,Это все равно неприемлемо?,SPEAKER_03
2537.405,2539.186,Лично у меня да.,SPEAKER_02
2539.286,2545.287,"Мне кажется, это вопрос нравственности каждого отдельного человека.",SPEAKER_02
2545.327,2550.209,"Это только мое мнение, но, конечно, я понимаю, что многие не согласятся.",SPEAKER_02
2550.79,2556.115," Давайте проверим, послушаем их возражения и увидим, смогут ли они вас переубедить.",SPEAKER_03
2556.175,2557.857,Попробуем.,SPEAKER_03
2557.957,2567.727,"Итак, кто из тех, кого увлекла эта идея согласия, может объяснить?",SPEAKER_03
2569.742,2574.743, Почему для вас этот аспект имеет моральное значение?,SPEAKER_03
2574.803,2577.284,И сошла бы жеребьевка в качестве согласия?,SPEAKER_03
2577.344,2579.985,"Если помните, Дадли предложил тянуть жеребий.",SPEAKER_03
2580.045,2590.628,"Если бы все согласились, было бы... Это... Было бы справедливо и правильно.",SPEAKER_03
2592.441,2596.882," Скажем, не повезло тому же Юнге, а дальше его убили и съели.",SPEAKER_03
2596.922,2599.403,Это был бы морально приемлемый вариант.,SPEAKER_05
2605.045,2608.706,Жребий в этой ситуации вам нравится больше.,SPEAKER_03
2608.746,2613.128,"Теперь я спрошу тех, для кого жребьевка морально приемлема.",SPEAKER_03
2613.188,2613.748,Почему так?,SPEAKER_03
2615.225,2624.528," По-моему, главный компонент преступления в том, что эти люди почему-то вдруг решили, что их жизнь важнее, чем его.",SPEAKER_04
2624.608,2627.95,Ведь это же суть любого преступления.,SPEAKER_04
2627.99,2633.371,"Что-то вроде «Моя жизнь, мои желания и нужды важнее твоих».",SPEAKER_04
2633.411,2635.132,Они на первом месте.,SPEAKER_04
2635.172,2642.415,"А если бы все тянули жребий, и любой мог бы умереть, каждый как бы согласился отдать жизнь за других.",SPEAKER_04
2642.455,2643.435,Тогда было бы нормально?,SPEAKER_03
2644.463,2649.126," Звучит диковато, но... Но морально приемлемо.",SPEAKER_04
2649.226,2650.306,Да.,SPEAKER_03
2650.346,2651.527,Как вас зовут?,SPEAKER_03
2651.607,2652.568,Мэтт.,SPEAKER_03
2652.828,2662.974,"То есть, по-вашему, Мэтт, вас беспокоит не акт каннибализма, а неправильный подход?",SPEAKER_03
2663.094,2665.055,"Ну, можно и так сказать, да.",SPEAKER_03
2665.135,2666.316,Ясно.,SPEAKER_03
2666.416,2673.46,"Единомышленники Мэтта, распространите мысль о том, почему жеребий...",SPEAKER_03
2675.092,2681.374," на ваш взгляд, был бы морально допустим?",SPEAKER_03
2681.434,2681.934,Слушаю.,SPEAKER_03
2681.974,2690.436,"Насколько я поняла, проблема заключалась в том, что с этим пареньком никто не обсуждал, произойдёт с ним что-то или всё же нет.",SPEAKER_02
2690.516,2697.597,"Неясно, тянул бы он жеребий или не стал бы, но ведь дело в том, что его просто решили убить.",SPEAKER_02
2697.657,2699.038,"Да, происходило всё именно так.",SPEAKER_03
2699.058,2699.458,Ну вот и...,SPEAKER_03
2699.998,2704.619," Но если бы все тянули жребий, и он бы проиграл, по-вашему, было бы нормально?",SPEAKER_03
2704.679,2709.18,"Да, потому что все знают, что кому-то придется умереть.",SPEAKER_02
2709.22,2712.741,"А тогда Юнга даже не знал, что велся такой разговор.",SPEAKER_02
2712.921,2717.542,"Ему никто не говорил, что «Эй, парень, тебе недолго осталось».",SPEAKER_02
2717.582,2721.523,"Хорошо, допустим, все согласились тянуть жребий.",SPEAKER_03
2721.583,2724.764,"Тянут, не везет снова Юнге, а потом он передумывает.",SPEAKER_03
2725.677,2729.919," Но они же договорились, это как устное соглашение, отказаться нельзя.",SPEAKER_02
2729.959,2732.14,"Все согласились, решение принято.",SPEAKER_02
2732.18,2742.365,"Все знают, понимают, ради чего умрут, и знают, что если проиграет кто-то другой, то они сами же будут питаться им.",SPEAKER_02
2742.405,2743.486,Хорошо.,SPEAKER_03
2743.666,2745.827,"А если он скажет, да, но проиграл-то я?",SPEAKER_03
2748.06,2755.125," Просто мне кажется, что вся проблема с моральной стороной в том, что с Юнгой ничего не обсуждалось.",SPEAKER_02
2755.165,2758.868,"И самое ужасное, он понятия не имел, что вообще происходит.",SPEAKER_02
2758.888,2763.412,"А если бы он об этом знал, то ситуация была бы менее спорная.",SPEAKER_02
2763.492,2764.633,"Понятно, хорошо.",SPEAKER_03
2764.673,2770.157,Теперь хотелось бы... Некоторые допускают такое убийство.,SPEAKER_03
2770.177,2770.757,Всего около 20%.,SPEAKER_03
2770.797,2771.438,Сторонники Маркуса.,SPEAKER_03
2778.15,2796.813," Были те, кто сказал, что проблема в отсутствии согласия, либо в виде жребия, либо в варианте, который предложила Кейтлин в случае сознательной жертвы ради других.",SPEAKER_03
2796.893,2804.415,В этом случае гораздо больше людей сочли убийство Юнге оправданным.,SPEAKER_03
2806.361,2824.151," Наконец, мне хотелось бы выслушать тех, кто считает, что даже согласие или жребий, что слабое бормотание Паркера «я готов умереть в последний момент» все равно ничего не значит.",SPEAKER_03
2824.191,2827.113,И почему убивать его было нельзя?,SPEAKER_03
2827.153,2828.273,Вы?,SPEAKER_03
2828.373,2833.696,Я все время склонялась к категорическому суждению о моральной приемлемости.,SPEAKER_02
2833.736,2834.697,"Но мне кажется, что",SPEAKER_02
2836.582,2843.946," Есть вариант, который примирил бы меня с убийством, проигравшего в жеребьевке, самоубийство.",SPEAKER_02
2843.986,2847.968,Чтобы никому другому не пришлось совершать это действие.,SPEAKER_02
2848.009,2851.21,Хотя и в этом случае будет принуждение.,SPEAKER_02
2851.23,2854.432,И еще в журнале Дадли как будто даже не раскаивается.,SPEAKER_02
2854.492,2855.873,Завтракал он.,SPEAKER_02
2855.913,2861.356,"Он как будто, как сказать, такое ощущение, что он вообще не ценит чужую жизнь.",SPEAKER_02
2861.376,2861.396,И...,SPEAKER_01
2863.277,2867.121, Из-за этого хочется занять в большей мере категорическую позицию.,SPEAKER_02
2867.141,2869.063,И книжкой в него ещё запустить.,SPEAKER_03
2869.123,2872.306,"За то, что не способен раскаяться или понять, что неправильно поступил.",SPEAKER_03
2872.326,2873.707,Именно.,SPEAKER_02
2874.047,2875.549,"Что ж, хорошо.",SPEAKER_03
2875.629,2878.151,Есть ещё.,SPEAKER_03
2878.211,2880.393,Кто так считает?,SPEAKER_05
2880.533,2883.536,"Нельзя было убивать, даже по согласию.",SPEAKER_03
2883.576,2883.937,Слушаю.,SPEAKER_04
2884.707,2885.187, Да?,SPEAKER_04
2885.287,2891.772,"Мне кажется, наше общество организовано таким образом, что убийство — это в любом случае убийство, без каких-либо оговорок.",SPEAKER_04
2891.812,2894.554,И нет никаких причин смотреть на эту ситуацию по-другому.,SPEAKER_04
2894.574,2896.335,А теперь позвольте задать вопрос.,SPEAKER_03
2896.415,2899.477,Речь шла о трех жизнях против одной.,SPEAKER_03
2899.497,2901.959,Понятно.,SPEAKER_03
2902.019,2903.32,И это одна?,SPEAKER_03
2903.44,2908.723,"Жизнь сироты, у которого нет семьи, нет жены и детей, которых надо кормить.",SPEAKER_03
2908.763,2912.866,"А у остальных в Британии были семьи, жены и детишки.",SPEAKER_03
2912.886,2913.787,Вспомните Бентема.,SPEAKER_03
2914.932,2919.693," По его мнению, нужно учитывать наибольшее количество пользы в пересчете на всех.",SPEAKER_03
2919.753,2922.994,Нужно подсчитать общее.,SPEAKER_03
2923.054,2926.115,Сумму трое или один.,SPEAKER_03
2926.135,2930.496,"Плюс семьи, которые остались в Англии.",SPEAKER_03
2930.536,2934.437,"Собственно, лондонская газета выразила распространенное мнение,",SPEAKER_03
2935.517,2938.858, И пожалела Дадли и Стивенса.,SPEAKER_03
2938.938,2945.581,"Если бы не любовь и забота о родных и близких, писал автор статьи, конечно же, они ни за что не решились бы на подобное.",SPEAKER_03
2945.701,2952.203,"Да, но чем это отличается от упырей в подворотнях, которые тоже хотят кормить свои семьи, сомневаясь, что есть какая-то разница?",SPEAKER_04
2952.223,2957.705,"В любом случае, если я прикончу вас, чтобы улучшить свое положение, это будет убийство, и так его надо воспринимать.",SPEAKER_04
2958.445,2965.25," а не переводить непонятные действия в криминальное поле, выставляя их в более серьезном свете.",SPEAKER_04
2965.31,2971.435,"Тут у нас одно и то же действие, а мы позволяем себе обдумывать, оправдывает ли его забота о семье.",SPEAKER_04
2971.495,2977.18,"Допустим, их было не три, а три десятка или три сотни.",SPEAKER_03
2978.852,2980.272, Одна жизнь за 300 человек.,SPEAKER_03
2980.372,2980.532,Ладно.,SPEAKER_03
2980.612,2982.053,"Или на войне 3000, а может и больше 3000.",SPEAKER_03
2982.653,2983.653,Пусть даже так.,SPEAKER_03
2983.713,2984.793,Пусть людей будет больше.,SPEAKER_03
2984.813,2985.813,Все равно.,SPEAKER_03
2985.893,2992.414,"Вы считаете, Бентом ошибался, говоря, что нужно оценивать наибольшее счастье?",SPEAKER_03
2992.514,2993.955,"Это не так, по-вашему?",SPEAKER_03
2993.995,2996.855,"Не думаю, что он был неправ, но убийство — это в любом случае убийство.",SPEAKER_04
2996.895,2998.435,"Ну, значит, Бентом все же ошибался.",SPEAKER_03
2998.495,2999.756,"Тут либо он прав, либо вы.",SPEAKER_03
2999.796,3000.936,"Значит, он неправ.",SPEAKER_04
3001.016,3004.356,"Ладно, спасибо, отлично.",SPEAKER_03
3004.416,3007.897,"Итак, давайте отвлечемся от нашей дискуссии и...",SPEAKER_03
3010.297,3014.878," Обратим внимание на то, сколько оказалось несогласных.",SPEAKER_03
3014.998,3023.721,"Кое-кто оправдал Дадли необходимостью, вынужденными обстоятельствами и соображением, пусть и скрытым, что важно число.",SPEAKER_03
3023.801,3034.744,"Но, как мы выяснили, при том важно еще и число людей, оставшихся дома, их домочадцев.",SPEAKER_03
3034.784,3037.345,"Паркер был сиротой, по нему никто не горевал бы.",SPEAKER_03
3039.695,3054.258," Если мы суммируем всю потенциальную пользу и довольство, сравним с горем, то, возможно, мы сказали бы, что Дадли и Стивенс поступили правильно.",SPEAKER_03
3054.358,3063.38,Однако не меньше трех человек предъявили разные аргументы против.,SPEAKER_03
3063.42,3067.761,"Например, тут кто-то сказал, что поступок в сущности недопустим категорически.",SPEAKER_03
3068.867,3077.351," Убийство есть убийство, и оно недопустимо даже ради счастья большинства, всего общества.",SPEAKER_03
3077.471,3080.313,Это принципиальное возражение.,SPEAKER_03
3080.353,3087.116,"Остается обсудить, почему убийство категорически недопустимо.",SPEAKER_03
3087.156,3092.519,"Потому ли, что у Юнги есть некие базовые права?",SPEAKER_03
3093.986,3102.431," И в этом случае, из чего они проистекают, если не из неких соображений об общественном благе, счастье, пользе?",SPEAKER_03
3102.471,3104.512,Это первый вопрос.,SPEAKER_03
3104.592,3111.436,"Некоторым показалось, что честный жребий исправил бы ситуацию.",SPEAKER_03
3111.476,3115.639,Это был Мэтт.,SPEAKER_03
3115.759,3120.241,И некоторые согласились.,SPEAKER_03
3120.281,3122.703,Это не совсем категорическое возражение.,SPEAKER_03
3123.777,3134.983," Это высказывание означает, что все должны быть равны, даже если любого могут принести в жертву ради общего блага.",SPEAKER_03
3135.023,3137.945,"Тут возникает другой вопрос, который стоит обсудить.",SPEAKER_03
3137.985,3149.431,"Почему согласие на определенную процедуру, пусть и справедливую, оправдывает любой результат, которому она может привести?",SPEAKER_03
