start,end,text,speaker
3149.471,3150.372,Это вопрос номер два.,SPEAKER_03
3151.703,3156.467, А третий — проблема согласия.,SPEAKER_01
3156.607,3160.03,Ее подсказала нам Кейтлин.,SPEAKER_03
3160.15,3171.079,"Если бы Юнга согласился умереть, и не под давлением, как уточнили, было бы уместно таким образом спасти остальных.",SPEAKER_03
3173.192,3178.475, Это показалось хорошим выходом очень многим из вас.,SPEAKER_03
3178.515,3182.137,Но отсюда возникает наш третий вопрос.,SPEAKER_03
3182.177,3185.96,Какую роль играет идея согласия в морали?,SPEAKER_03
3186.04,3198.287,"Почему активное согласие меняет наше отношение к деянию таким образом, что убийство, неприемлемое без него, становится морально приемлемым?",SPEAKER_03
3201.308,3205.691," Чтобы попробовать ответить на эти вопросы, придется почитать философов.",SPEAKER_03
3205.711,3211.855,"В следующий раз нас ждут Бентом и Джон Стюарт Миль, сторонники утилитаризма.",SPEAKER_03
